{
  "$schema": "https://json-schema.org/draft/2020-12/schema",
  "$id": "https://crypto-quant.local/schemas/v064-public-ci-witness-v1.schema.json",
  "title": "V0.64 public Linux CI witness V1",
  "type": "object",
  "additionalProperties": false,
  "required": ["$schema", "schema_version", "witness_id", "witness_hash", "status", "predecessor_failed_public_witnesses", "private_source", "public_source", "bundle", "workflow", "run", "jobs", "raw_evidence", "ancestry", "safety", "non_claims"],
  "properties": {
    "$schema": {"const": "./v064-public-ci-witness-v1.schema.json"},
    "schema_version": {"const": "1.2.0"},
    "witness_id": {"type": "string", "pattern": "^v064_public_ci_witness_[0-9a-f]{64}$"},
    "witness_hash": {"$ref": "#/$defs/hash"},
    "status": {"const": "PUBLIC_LINUX_PORTABILITY_WITNESS_COMPLETED"},
    "predecessor_failed_public_witnesses": {"$ref": "#/$defs/predecessor_failed_public_witnesses"},
    "private_source": {"$ref": "#/$defs/private_source"},
    "public_source": {"$ref": "#/$defs/public_source"},
    "bundle": {"$ref": "#/$defs/bundle"},
    "workflow": {"$ref": "#/$defs/workflow"},
    "run": {"$ref": "#/$defs/run"},
    "jobs": {"$ref": "#/$defs/jobs"},
    "raw_evidence": {"$ref": "#/$defs/raw_evidence"},
    "ancestry": {"$ref": "#/$defs/ancestry"},
    "safety": {"$ref": "#/$defs/safety"},
    "non_claims": {"$ref": "#/$defs/non_claims"}
  },
  "$defs": {
    "hash": {"type": "string", "pattern": "^[0-9a-f]{64}$"},
    "git_oid": {"type": "string", "pattern": "^[0-9a-f]{40}$"},
    "failed_job": {
      "type": "object",
      "additionalProperties": false,
      "required": ["python_version", "job_id", "conclusion", "test_step_conclusion"],
      "properties": {
        "python_version": {"enum": ["3.9", "3.12"]},
        "job_id": {"type": "integer", "minimum": 1, "maximum": 9007199254740991},
        "conclusion": {"const": "failure"},
        "test_step_conclusion": {"const": "skipped"}
      }
    },
    "failed_jobs": {
      "type": "array",
      "minItems": 2,
      "maxItems": 2,
      "prefixItems": [
        {"allOf": [{"$ref": "#/$defs/failed_job"}, {"properties": {"python_version": {"const": "3.9"}, "job_id": {"const": 94924270273}}}]},
        {"allOf": [{"$ref": "#/$defs/failed_job"}, {"properties": {"python_version": {"const": "3.12"}, "job_id": {"const": 94924270340}}}]}
      ],
      "items": false
    },
    "predecessor_failed_public_witness": {
      "type": "object",
      "additionalProperties": false,
      "required": ["repository", "private_candidate_f", "private_tree_f", "public_commit", "public_tree", "manifest_sha256", "file_set_sha256", "workflow_blob_oid", "run_id", "run_attempt", "event", "head_branch", "status", "conclusion", "jobs", "reason_code", "run_json_sha256", "jobs_json_sha256", "run_log_sha256", "transcript_summary_sha256"],
      "properties": {
        "repository": {"const": "cjl308868584-lang/crypto-quant-v064-public-ci"},
        "private_candidate_f": {"const": "1967f79ff8d013bf149bf36e2cdcb6a81ed200ff"},
        "private_tree_f": {"const": "5389cc01164ce6dd5955df1d014e974f4bf1a104"},
        "public_commit": {"const": "0429837e5de8052e9e8216ed08ba9c7aa9c905b3"},
        "public_tree": {"const": "4ebb723e73dc9eb43b7273febd96af3ef87ef951"},
        "manifest_sha256": {"const": "c238c904495b167e436b2c32e822d8fa55285e42eaaad8e095805e73570e3fd7"},
        "file_set_sha256": {"const": "2d7ed3d4b3380b43e50f16f04113eae46360397e46aeba2edd639ce46a7f76c7"},
        "workflow_blob_oid": {"const": "d2c0104eafb8e1aa5ea68a60f716921f2668ce42"},
        "run_id": {"const": 31850146784},
        "run_attempt": {"const": 1},
        "event": {"const": "push"},
        "head_branch": {"const": "main"},
        "status": {"const": "completed"},
        "conclusion": {"const": "failure"},
        "jobs": {"$ref": "#/$defs/failed_jobs"},
        "reason_code": {"const": "PUBLIC_SENSITIVE_BYTES_INVALID"},
        "run_json_sha256": {"const": "f442ae366539fc4a244977fdafb2cd5de383b4248483381d8d79b751ea6a6099"},
        "jobs_json_sha256": {"const": "9a69273c07548e97dbc2f43883eea4b5935f84256b7ad95b2874ca498bc67923"},
        "run_log_sha256": {"const": "e47462120131eadb3161a40ffe679f4f74889103d7b3a13bb563df705f9ef32c"},
        "transcript_summary_sha256": {"const": "cd2072e246698bec6d8767d37da4a3dca82d09fc38466a8009aea9690a0c9790"}
      }
    },
    "predecessor_failed_public_witnesses": {
      "type": "array",
      "minItems": 2,
      "maxItems": 2,
      "prefixItems": [
        {"$ref": "#/$defs/predecessor_failed_public_witness"},
        {"$ref": "#/$defs/r2_failed_public_witness"}
      ],
      "items": false
    },
    "r2_failed_public_witness": {
      "const": {"failure_record_path":"artifacts/v064-public-ci-r2-failure/v064-public-ci-r2-failure-record-v1.json","failure_record_sha256":"857150ae490e54d5b6bdaa816efb96cf3f24a9778220f61973312426644dd264","$schema":"./v064-public-ci-r2-failure-record-v1.schema.json","acquisition":{"stderr":{"sha256":"e3b0c44298fc1c149afbf4c8996fb92427ae41e4649b934ca495991b7852b855","size":0}},"bundle":{"file_set_sha256":"6c6d5bde35d1f5f4e484f5874b47fad3d0f575eef4eeb8e4deb9de659be4eb69","manifest_sha256":"b2017d2e4099ee64d0cbbcbd35f38b1833fbe351d2696f70248ad60056b20ae2"},"expected_python_versions":["3.9","3.12"],"jobs":[{"github_conclusion":"success","job_id":96305223463,"observed_fixed_owner_version":"3.12.3","python_version":"3.9"},{"github_conclusion":"success","job_id":96305223215,"observed_fixed_owner_version":"3.12.3","python_version":"3.12"}],"observed_fixed_owner_versions":["3.12.3","3.12.3"],"private_source":{"candidate_commit":"5bc01c9b9b9d9a21846dd8c6ba1d81b0183dd219","candidate_tree":"53d3baf7d7c84e5bc8fcafa2561bbb959477ac4d"},"public_source":{"repository":"cjl308868584-lang/crypto-quant-v064-public-ci-r2","root_commit":"5541aba00e4e93e6389c2c61a81e69c2dd228947","root_tree":"3d732e8e1fbb9cf94541f6e26e778d5eb21ca8f3"},"raw_evidence":{"jobs_api":{"path":"artifacts/v064-public-ci-r2-failure/v064-public-ci-r2-jobs-api-v1.json","sha256":"3078337f2f8e5aa9add1b099391e19125d5dcdeaef803e1f50d9666716ad773c","size":2312},"run_api":{"path":"artifacts/v064-public-ci-r2-failure/v064-public-ci-r2-run-api-v1.json","sha256":"310d2cad6840dc80d4cbcd6cc229d32704fd3c8854b44b6bbd893b708d4f9986","size":363},"run_log":{"path":"artifacts/v064-public-ci-r2-failure/v064-public-ci-r2-run-log-v1.txt","sha256":"e6ee2bcf599cff56b0bcda8292bdb7a85e5ef186973f4fe3a14c67f97a0bbf47","size":105558}},"readback_provenance":"POST_RUN_READ_ONLY_READBACK","reason_code":"PUBLIC_MATRIX_INTERPRETER_IDENTITY_MISMATCH","run":{"event":"push","github_conclusion":"success","head_branch":"main","run_attempt":1,"run_id":32328770160,"status":"completed"},"safety":{"broker_allowed":false,"credentials_present":false,"orders_allowed":false,"production_activation":false,"runtime_state_write_allowed":false},"schema_version":"1.0.0","setup_python":{"installed_version":"3.9.25","python_version":"3.9"},"status":"PUBLIC_LINUX_PORTABILITY_WITNESS_DID_NOT_PASS","success_witness_published":false,"workflow":{"blob_oid":"ba5b6851ed53ad79100409b92c78c09c07608ed2","path":".github/workflows/ci.yml"}}
    },
    "timestamp": {"type": "string", "pattern": "^[0-9]{4}-[0-9]{2}-[0-9]{2}T[0-9]{2}:[0-9]{2}:[0-9]{2}Z$"},
    "private_source": {
      "type": "object",
      "additionalProperties": false,
      "required": ["repository", "candidate_commit", "candidate_tree", "object_format", "historical_billing_blocked_private_pr"],
      "properties": {
        "repository": {"const": "cjl308868584-lang/crypto-quant-core"},
        "candidate_commit": {"$ref": "#/$defs/git_oid"},
        "candidate_tree": {"$ref": "#/$defs/git_oid"},
        "object_format": {"const": "sha1"},
        "historical_billing_blocked_private_pr": {
          "type": "object",
          "additionalProperties": false,
          "required": ["number", "run_id", "status"],
          "properties": {
            "number": {"const": 32},
            "run_id": {"const": 31436609135},
            "status": {"const": "PRIVATE_PR_CI_NOT_EXECUTED_BILLING_BLOCKED"}
          }
        }
      }
    },
    "public_source": {
      "type": "object",
      "additionalProperties": false,
      "required": ["repository", "commit", "tree", "branch", "parent_count"],
      "properties": {
        "repository": {"const": "cjl308868584-lang/crypto-quant-v064-public-ci-r3"},
        "commit": {"$ref": "#/$defs/git_oid"},
        "tree": {"$ref": "#/$defs/git_oid"},
        "branch": {"const": "main"},
        "parent_count": {"const": 0}
      }
    },
    "bundle": {
      "type": "object",
      "additionalProperties": false,
      "required": ["manifest_sha256", "file_set_sha256"],
      "properties": {
        "manifest_sha256": {"$ref": "#/$defs/hash"},
        "file_set_sha256": {"$ref": "#/$defs/hash"}
      }
    },
    "workflow": {
      "type": "object",
      "additionalProperties": false,
      "required": ["path", "blob_oid", "sha256"],
      "properties": {
        "path": {"const": ".github/workflows/ci.yml"},
        "blob_oid": {"$ref": "#/$defs/git_oid"},
        "sha256": {"$ref": "#/$defs/hash"}
      }
    },
    "run": {
      "type": "object",
      "additionalProperties": false,
      "required": ["run_id", "workflow_id", "run_attempt", "event", "head_branch", "head_sha", "status", "conclusion", "created_at", "updated_at"],
      "properties": {
        "run_id": {"type": "integer", "minimum": 1, "maximum": 9007199254740991},
        "workflow_id": {"type": "integer", "minimum": 1, "maximum": 9007199254740991},
        "run_attempt": {"const": 1},
        "event": {"const": "push"},
        "head_branch": {"const": "main"},
        "head_sha": {"$ref": "#/$defs/git_oid"},
        "status": {"const": "completed"},
        "conclusion": {"const": "success"},
        "created_at": {"$ref": "#/$defs/timestamp"},
        "updated_at": {"$ref": "#/$defs/timestamp"}
      }
    },
    "step": {
      "type": "object",
      "additionalProperties": false,
      "required": ["number", "name", "status", "conclusion"],
      "properties": {
        "number": {"type": "integer", "minimum": 1},
        "name": {"type": "string", "minLength": 1},
        "status": {"const": "completed"},
        "conclusion": {"const": "success"}
      }
    },
    "job": {
      "type": "object",
      "additionalProperties": false,
      "required": ["python_version", "setup_python_version", "fixed_owner_python_version", "job_id", "name", "status", "conclusion", "runner_os", "started_at", "completed_at", "steps"],
      "properties": {
        "python_version": {"enum": ["3.9", "3.12"]},
        "setup_python_version": {"type": "string", "pattern": "^3\\.(?:9|12)\\.[0-9]+$"},
        "fixed_owner_python_version": {"type": "string", "pattern": "^3\\.(?:9|12)\\.[0-9]+$"},
        "job_id": {"type": "integer", "minimum": 1, "maximum": 9007199254740991},
        "name": {"type": "string", "minLength": 1},
        "status": {"const": "completed"},
        "conclusion": {"const": "success"},
        "runner_os": {"const": "Linux"},
        "started_at": {"$ref": "#/$defs/timestamp"},
        "completed_at": {"$ref": "#/$defs/timestamp"},
        "steps": {"type": "array", "minItems": 1, "items": {"$ref": "#/$defs/step"}}
      }
    },
    "jobs": {
      "type": "array",
      "minItems": 2,
      "maxItems": 2,
      "prefixItems": [
        {"allOf": [{"$ref": "#/$defs/job"}, {"properties": {"python_version": {"const": "3.9"}, "setup_python_version": {"pattern": "^3\\.9\\.[0-9]+$"}, "fixed_owner_python_version": {"pattern": "^3\\.9\\.[0-9]+$"}}}]},
        {"allOf": [{"$ref": "#/$defs/job"}, {"properties": {"python_version": {"const": "3.12"}, "setup_python_version": {"pattern": "^3\\.12\\.[0-9]+$"}, "fixed_owner_python_version": {"pattern": "^3\\.12\\.[0-9]+$"}}}]}
      ],
      "items": false
    },
    "raw_file": {
      "type": "object",
      "additionalProperties": false,
      "required": ["path", "size", "sha256"],
      "properties": {
        "path": {"type": "string", "minLength": 1},
        "size": {"type": "integer", "minimum": 1, "maximum": 67108864},
        "sha256": {"$ref": "#/$defs/hash"}
      }
    },
    "raw_evidence": {
      "type": "object",
      "additionalProperties": false,
      "required": ["run_api", "jobs_api", "run_log", "acquisition_transcript"],
      "properties": {
        "run_api": {"allOf": [{"$ref": "#/$defs/raw_file"}, {"properties": {"path": {"const": "artifacts/v064-public-ci-r3/v064-public-ci-r3-run-api-v1.json"}}}]},
        "jobs_api": {"allOf": [{"$ref": "#/$defs/raw_file"}, {"properties": {"path": {"const": "artifacts/v064-public-ci-r3/v064-public-ci-r3-jobs-api-v1.json"}}}]},
        "run_log": {"allOf": [{"$ref": "#/$defs/raw_file"}, {"properties": {"path": {"const": "artifacts/v064-public-ci-r3/v064-public-ci-r3-run-log-v1.txt"}}}]},
        "acquisition_transcript": {"allOf": [{"$ref": "#/$defs/raw_file"}, {"properties": {"path": {"const": "artifacts/v064-public-ci-r3/v064-public-ci-r3-acquisition-transcript-v1.json"}}}]}
      }
    },
    "ancestry": {
      "type": "object",
      "additionalProperties": false,
      "required": ["witness_binds_private_source_f", "public_commit_is_parentless", "candidate_g_not_yet_bound"],
      "properties": {
        "witness_binds_private_source_f": {"const": true},
        "public_commit_is_parentless": {"const": true},
        "candidate_g_not_yet_bound": {"const": true}
      }
    },
    "safety": {
      "type": "object",
      "additionalProperties": false,
      "required": ["production_activation", "credentials_present", "broker_allowed", "orders_allowed", "runtime_state_write_allowed"],
      "properties": {
        "production_activation": {"const": false},
        "credentials_present": {"const": false},
        "broker_allowed": {"const": false},
        "orders_allowed": {"const": false},
        "runtime_state_write_allowed": {"const": false}
      }
    },
    "non_claims": {
      "type": "array",
      "prefixItems": [
        {"const": "NOT_FULL_PROJECT_CI"},
        {"const": "NOT_PRIVATE_PR_CHECK"},
        {"const": "NOT_STRATEGY_CORRECTNESS_EVIDENCE"},
        {"const": "NOT_PROFITABILITY_OR_AI_ADVANTAGE_EVIDENCE"},
        {"const": "NOT_PAPER_CANARY_OR_LIVE_TRADING_AUTHORIZATION"}
      ],
      "items": false,
      "minItems": 5,
      "maxItems": 5
    }
  }
}
