{"$schema":"./v064-public-ci-witness-v1.schema.json","ancestry":{"candidate_g_not_yet_bound":true,"public_commit_is_parentless":true,"witness_binds_private_source_f":true},"bundle":{"file_set_sha256":"af99cedf41dc40b20e5caa290828e2d7110ef5b664e502e17c0b504bd4df9309","manifest_sha256":"138cfa89928b639887d7b0636e9eec547ccb56f0f91bde20d795745e8057eb5b"},"jobs":[{"completed_at":"2026-08-21T01:07:31Z","conclusion":"success","fixed_owner_python_version":"3.9.25","job_id":96634805095,"name":"portability (3.9)","python_version":"3.9","runner_os":"Linux","setup_python_version":"3.9.25","started_at":"2026-08-21T01:07:18Z","status":"completed","steps":[{"conclusion":"success","name":"Set up job","number":1,"status":"completed"},{"conclusion":"success","name":"Run actions/checkout@fbc6f3992d24b796d5a048ff273f7fcc4a7b6c09","number":2,"status":"completed"},{"conclusion":"success","name":"Verify closed bundle before repository imports","number":3,"status":"completed"},{"conclusion":"success","name":"Run actions/setup-python@ece7cb06caefa5fff74198d8649806c4678c61a1","number":4,"status":"completed"},{"conclusion":"success","name":"Run fixed-owner public boundary","number":5,"status":"completed"},{"conclusion":"success","name":"Post Run actions/setup-python@ece7cb06caefa5fff74198d8649806c4678c61a1","number":9,"status":"completed"},{"conclusion":"success","name":"Post Run actions/checkout@fbc6f3992d24b796d5a048ff273f7fcc4a7b6c09","number":10,"status":"completed"},{"conclusion":"success","name":"Complete job","number":11,"status":"completed"}]},{"completed_at":"2026-08-21T01:07:26Z","conclusion":"success","fixed_owner_python_version":"3.12.14","job_id":96634805278,"name":"portability (3.12)","python_version":"3.12","runner_os":"Linux","setup_python_version":"3.12.14","started_at":"2026-08-21T01:07:18Z","status":"completed","steps":[{"conclusion":"success","name":"Set up job","number":1,"status":"completed"},{"conclusion":"success","name":"Run actions/checkout@fbc6f3992d24b796d5a048ff273f7fcc4a7b6c09","number":2,"status":"completed"},{"conclusion":"success","name":"Verify closed bundle before repository imports","number":3,"status":"completed"},{"conclusion":"success","name":"Run actions/setup-python@ece7cb06caefa5fff74198d8649806c4678c61a1","number":4,"status":"completed"},{"conclusion":"success","name":"Run fixed-owner public boundary","number":5,"status":"completed"},{"conclusion":"success","name":"Post Run actions/setup-python@ece7cb06caefa5fff74198d8649806c4678c61a1","number":9,"status":"completed"},{"conclusion":"success","name":"Post Run actions/checkout@fbc6f3992d24b796d5a048ff273f7fcc4a7b6c09","number":10,"status":"completed"},{"conclusion":"success","name":"Complete job","number":11,"status":"completed"}]}],"non_claims":["NOT_FULL_PROJECT_CI","NOT_PRIVATE_PR_CHECK","NOT_STRATEGY_CORRECTNESS_EVIDENCE","NOT_PROFITABILITY_OR_AI_ADVANTAGE_EVIDENCE","NOT_PAPER_CANARY_OR_LIVE_TRADING_AUTHORIZATION"],"predecessor_failed_public_witnesses":[{"conclusion":"failure","event":"push","file_set_sha256":"2d7ed3d4b3380b43e50f16f04113eae46360397e46aeba2edd639ce46a7f76c7","head_branch":"main","jobs":[{"conclusion":"failure","job_id":94924270273,"python_version":"3.9","test_step_conclusion":"skipped"},{"conclusion":"failure","job_id":94924270340,"python_version":"3.12","test_step_conclusion":"skipped"}],"jobs_json_sha256":"9a69273c07548e97dbc2f43883eea4b5935f84256b7ad95b2874ca498bc67923","manifest_sha256":"c238c904495b167e436b2c32e822d8fa55285e42eaaad8e095805e73570e3fd7","private_candidate_f":"1967f79ff8d013bf149bf36e2cdcb6a81ed200ff","private_tree_f":"5389cc01164ce6dd5955df1d014e974f4bf1a104","public_commit":"0429837e5de8052e9e8216ed08ba9c7aa9c905b3","public_tree":"4ebb723e73dc9eb43b7273febd96af3ef87ef951","reason_code":"PUBLIC_SENSITIVE_BYTES_INVALID","repository":"cjl308868584-lang/crypto-quant-v064-public-ci","run_attempt":1,"run_id":31850146784,"run_json_sha256":"f442ae366539fc4a244977fdafb2cd5de383b4248483381d8d79b751ea6a6099","run_log_sha256":"e47462120131eadb3161a40ffe679f4f74889103d7b3a13bb563df705f9ef32c","status":"completed","transcript_summary_sha256":"cd2072e246698bec6d8767d37da4a3dca82d09fc38466a8009aea9690a0c9790","workflow_blob_oid":"d2c0104eafb8e1aa5ea68a60f716921f2668ce42"},{"$schema":"./v064-public-ci-r2-failure-record-v1.schema.json","acquisition":{"stderr":{"sha256":"e3b0c44298fc1c149afbf4c8996fb92427ae41e4649b934ca495991b7852b855","size":0}},"bundle":{"file_set_sha256":"6c6d5bde35d1f5f4e484f5874b47fad3d0f575eef4eeb8e4deb9de659be4eb69","manifest_sha256":"b2017d2e4099ee64d0cbbcbd35f38b1833fbe351d2696f70248ad60056b20ae2"},"expected_python_versions":["3.9","3.12"],"failure_record_path":"artifacts/v064-public-ci-r2-failure/v064-public-ci-r2-failure-record-v1.json","failure_record_sha256":"857150ae490e54d5b6bdaa816efb96cf3f24a9778220f61973312426644dd264","jobs":[{"github_conclusion":"success","job_id":96305223463,"observed_fixed_owner_version":"3.12.3","python_version":"3.9"},{"github_conclusion":"success","job_id":96305223215,"observed_fixed_owner_version":"3.12.3","python_version":"3.12"}],"observed_fixed_owner_versions":["3.12.3","3.12.3"],"private_source":{"candidate_commit":"5bc01c9b9b9d9a21846dd8c6ba1d81b0183dd219","candidate_tree":"53d3baf7d7c84e5bc8fcafa2561bbb959477ac4d"},"public_source":{"repository":"cjl308868584-lang/crypto-quant-v064-public-ci-r2","root_commit":"5541aba00e4e93e6389c2c61a81e69c2dd228947","root_tree":"3d732e8e1fbb9cf94541f6e26e778d5eb21ca8f3"},"raw_evidence":{"jobs_api":{"path":"artifacts/v064-public-ci-r2-failure/v064-public-ci-r2-jobs-api-v1.json","sha256":"3078337f2f8e5aa9add1b099391e19125d5dcdeaef803e1f50d9666716ad773c","size":2312},"run_api":{"path":"artifacts/v064-public-ci-r2-failure/v064-public-ci-r2-run-api-v1.json","sha256":"310d2cad6840dc80d4cbcd6cc229d32704fd3c8854b44b6bbd893b708d4f9986","size":363},"run_log":{"path":"artifacts/v064-public-ci-r2-failure/v064-public-ci-r2-run-log-v1.txt","sha256":"e6ee2bcf599cff56b0bcda8292bdb7a85e5ef186973f4fe3a14c67f97a0bbf47","size":105558}},"readback_provenance":"POST_RUN_READ_ONLY_READBACK","reason_code":"PUBLIC_MATRIX_INTERPRETER_IDENTITY_MISMATCH","run":{"event":"push","github_conclusion":"success","head_branch":"main","run_attempt":1,"run_id":32328770160,"status":"completed"},"safety":{"broker_allowed":false,"credentials_present":false,"orders_allowed":false,"production_activation":false,"runtime_state_write_allowed":false},"schema_version":"1.0.0","setup_python":{"installed_version":"3.9.25","python_version":"3.9"},"status":"PUBLIC_LINUX_PORTABILITY_WITNESS_DID_NOT_PASS","success_witness_published":false,"workflow":{"blob_oid":"ba5b6851ed53ad79100409b92c78c09c07608ed2","path":".github/workflows/ci.yml"}}],"private_source":{"candidate_commit":"f9705fa2151ab98a5b9efe63be05979e4bc5bfa6","candidate_tree":"c3ed7d9a506d2a3c1531b0cb979a564f52991145","historical_billing_blocked_private_pr":{"number":32,"run_id":31436609135,"status":"PRIVATE_PR_CI_NOT_EXECUTED_BILLING_BLOCKED"},"object_format":"sha1","repository":"cjl308868584-lang/crypto-quant-core"},"public_source":{"branch":"main","commit":"460ec57568e863b2e39e7572193f2545542d586b","parent_count":0,"repository":"cjl308868584-lang/crypto-quant-v064-public-ci-r3","tree":"2ab63c4fdecb06d0a4498365b9debd53a122a2ba"},"raw_evidence":{"acquisition_transcript":{"path":"artifacts/v064-public-ci-r3/v064-public-ci-r3-acquisition-transcript-v1.json","sha256":"1dd8cd4a5920bdade465c655f6f8a59c6b62adae1b62f7f93b09c1a385e790da","size":1698},"jobs_api":{"path":"artifacts/v064-public-ci-r3/v064-public-ci-r3-jobs-api-v1.json","sha256":"6b752ccefd77281542ba603eded94f0d459a7d4f86bfe2a623893dbb200bc7fa","size":2312},"run_api":{"path":"artifacts/v064-public-ci-r3/v064-public-ci-r3-run-api-v1.json","sha256":"e617d41ea4e09215ef917160f1ac39c94224040582a2029c339481a05535a70b","size":363},"run_log":{"path":"artifacts/v064-public-ci-r3/v064-public-ci-r3-run-log-v1.txt","sha256":"6b8fd0fb32f7c060b06805151e63417bbac66cb253ed647b2be11fc66313d1ef","size":106671}},"run":{"conclusion":"success","created_at":"2026-08-21T01:07:15Z","event":"push","head_branch":"main","head_sha":"460ec57568e863b2e39e7572193f2545542d586b","run_attempt":1,"run_id":32435172937,"status":"completed","updated_at":"2026-08-21T01:07:32Z","workflow_id":339016620},"safety":{"broker_allowed":false,"credentials_present":false,"orders_allowed":false,"production_activation":false,"runtime_state_write_allowed":false},"schema_version":"1.2.0","status":"PUBLIC_LINUX_PORTABILITY_WITNESS_COMPLETED","witness_hash":"f90c46551bf08b4b22509c0946576359cfa9186494c7925ef292639629c1a32a","witness_id":"v064_public_ci_witness_73d6a8bbd96a3705613924f34e464204a138320211f4f206160accf487f715da","workflow":{"blob_oid":"482a982fe1d523f8eea70e36a6f43c4b9498da20","path":".github/workflows/ci.yml","sha256":"1c1d982c31eb348f5568464a7db40d9177bba8202b939ebc7e033a843eac5407"}}
